{
  "$schema": "https://json-schema.org/draft/2020-12/schema",
  "$id": "urn:super-editor:document:1",
  "title": "Super Editor v1 ResearchDocument",
  "type": "object",
  "properties": {
    "schemaVersion": {
      "const": 1
    },
    "id": {
      "type": "string",
      "minLength": 1,
      "maxLength": 128,
      "pattern": "^[A-Za-z0-9][A-Za-z0-9._:-]*$"
    },
    "title": {
      "type": "string",
      "maxLength": 1000
    },
    "revision": {
      "type": "integer",
      "minimum": 0,
      "maximum": 9007199254740991
    },
    "createdAt": {
      "type": "string",
      "maxLength": 30,
      "format": "date-time",
      "pattern": "^\\d{4}-\\d{2}-\\d{2}T\\d{2}:\\d{2}:\\d{2}(?:\\.\\d{1,3})?Z$"
    },
    "updatedAt": {
      "type": "string",
      "maxLength": 30,
      "format": "date-time",
      "pattern": "^\\d{4}-\\d{2}-\\d{2}T\\d{2}:\\d{2}:\\d{2}(?:\\.\\d{1,3})?Z$"
    },
    "format": {
      "$ref": "#/$defs/format"
    },
    "blocks": {
      "type": "array",
      "maxItems": 5000,
      "items": {
        "$ref": "#/$defs/persistedBlock"
      }
    },
    "citations": {
      "type": "array",
      "maxItems": 2000,
      "items": {
        "$ref": "#/$defs/citation"
      }
    },
    "retiredBlockIds": {
      "type": "array",
      "maxItems": 100000,
      "uniqueItems": true,
      "items": {
        "type": "string",
        "minLength": 1,
        "maxLength": 128,
        "pattern": "^[A-Za-z0-9][A-Za-z0-9._:-]*$"
      }
    }
  },
  "required": [
    "schemaVersion",
    "id",
    "title",
    "revision",
    "createdAt",
    "updatedAt",
    "format",
    "blocks",
    "citations",
    "retiredBlockIds"
  ],
  "additionalProperties": false,
  "$defs": {
    "operation": {
      "anyOf": [
        {
          "type": "object",
          "properties": {
            "type": {
              "const": "insertBlock"
            },
            "block": {
              "$ref": "#/$defs/block"
            },
            "afterId": {
              "anyOf": [
                {
                  "type": "string",
                  "minLength": 1,
                  "maxLength": 128,
                  "pattern": "^[A-Za-z0-9][A-Za-z0-9._:-]*$"
                },
                {
                  "type": "null"
                }
              ]
            }
          },
          "required": [
            "type",
            "block"
          ],
          "additionalProperties": false
        },
        {
          "type": "object",
          "properties": {
            "type": {
              "const": "updateBlock"
            },
            "blockId": {
              "type": "string",
              "minLength": 1,
              "maxLength": 128,
              "pattern": "^[A-Za-z0-9][A-Za-z0-9._:-]*$"
            },
            "expectedVersion": {
              "type": "integer",
              "minimum": 1,
              "maximum": 9007199254740991
            },
            "content": {
              "$ref": "#/$defs/content"
            },
            "citationIds": {
              "type": "array",
              "maxItems": 2000,
              "uniqueItems": true,
              "items": {
                "type": "string",
                "minLength": 1,
                "maxLength": 128,
                "pattern": "^[A-Za-z0-9][A-Za-z0-9._:-]*$"
              }
            }
          },
          "required": [
            "type",
            "blockId",
            "expectedVersion",
            "content"
          ],
          "additionalProperties": false
        },
        {
          "type": "object",
          "properties": {
            "type": {
              "const": "moveBlock"
            },
            "blockId": {
              "type": "string",
              "minLength": 1,
              "maxLength": 128,
              "pattern": "^[A-Za-z0-9][A-Za-z0-9._:-]*$"
            },
            "expectedVersion": {
              "type": "integer",
              "minimum": 1,
              "maximum": 9007199254740991
            },
            "parentId": {
              "anyOf": [
                {
                  "type": "string",
                  "minLength": 1,
                  "maxLength": 128,
                  "pattern": "^[A-Za-z0-9][A-Za-z0-9._:-]*$"
                },
                {
                  "type": "null"
                }
              ]
            },
            "afterId": {
              "anyOf": [
                {
                  "type": "string",
                  "minLength": 1,
                  "maxLength": 128,
                  "pattern": "^[A-Za-z0-9][A-Za-z0-9._:-]*$"
                },
                {
                  "type": "null"
                }
              ]
            }
          },
          "required": [
            "type",
            "blockId",
            "expectedVersion",
            "parentId"
          ],
          "additionalProperties": false
        },
        {
          "type": "object",
          "properties": {
            "type": {
              "const": "deleteBlock"
            },
            "blockId": {
              "type": "string",
              "minLength": 1,
              "maxLength": 128,
              "pattern": "^[A-Za-z0-9][A-Za-z0-9._:-]*$"
            },
            "expectedVersion": {
              "type": "integer",
              "minimum": 1,
              "maximum": 9007199254740991
            }
          },
          "required": [
            "type",
            "blockId",
            "expectedVersion"
          ],
          "additionalProperties": false
        },
        {
          "type": "object",
          "properties": {
            "type": {
              "const": "setTitle"
            },
            "title": {
              "type": "string",
              "maxLength": 1000
            }
          },
          "required": [
            "type",
            "title"
          ],
          "additionalProperties": false
        },
        {
          "type": "object",
          "properties": {
            "type": {
              "const": "setFormat"
            },
            "format": {
              "$ref": "#/$defs/format"
            }
          },
          "required": [
            "type",
            "format"
          ],
          "additionalProperties": false
        },
        {
          "type": "object",
          "properties": {
            "type": {
              "const": "addCitation"
            },
            "citation": {
              "$ref": "#/$defs/citation"
            }
          },
          "required": [
            "type",
            "citation"
          ],
          "additionalProperties": false
        }
      ]
    },
    "content": {
      "anyOf": [
        {
          "type": "object",
          "properties": {
            "type": {
              "const": "section"
            },
            "title": {
              "type": "string",
              "maxLength": 1000
            }
          },
          "required": [
            "type",
            "title"
          ],
          "additionalProperties": false
        },
        {
          "type": "object",
          "properties": {
            "type": {
              "const": "heading"
            },
            "level": {
              "enum": [
                2,
                3
              ]
            },
            "text": {
              "type": "string",
              "maxLength": 100000
            }
          },
          "required": [
            "type",
            "level",
            "text"
          ],
          "additionalProperties": false
        },
        {
          "type": "object",
          "properties": {
            "type": {
              "const": "paragraph"
            },
            "runs": {
              "type": "array",
              "maxItems": 1000,
              "items": {
                "type": "object",
                "properties": {
                  "text": {
                    "type": "string",
                    "maxLength": 100000
                  },
                  "bold": {
                    "type": "boolean"
                  },
                  "italic": {
                    "type": "boolean"
                  },
                  "code": {
                    "type": "boolean"
                  },
                  "href": {
                    "type": "string",
                    "maxLength": 4096,
                    "format": "uri"
                  }
                },
                "required": [
                  "text"
                ],
                "additionalProperties": false
              }
            }
          },
          "required": [
            "type",
            "runs"
          ],
          "additionalProperties": false
        },
        {
          "type": "object",
          "properties": {
            "type": {
              "const": "list"
            },
            "ordered": {
              "type": "boolean"
            },
            "items": {
              "type": "array",
              "items": {
                "type": "string",
                "maxLength": 100000
              }
            }
          },
          "required": [
            "type",
            "ordered",
            "items"
          ],
          "additionalProperties": false
        },
        {
          "type": "object",
          "properties": {
            "type": {
              "const": "table"
            },
            "columns": {
              "type": "array",
              "items": {
                "type": "string",
                "maxLength": 100000
              }
            },
            "rows": {
              "type": "array",
              "items": {
                "type": "array",
                "items": {
                  "type": "string",
                  "maxLength": 100000
                }
              }
            }
          },
          "required": [
            "type",
            "columns",
            "rows"
          ],
          "additionalProperties": false
        },
        {
          "type": "object",
          "properties": {
            "type": {
              "const": "chart"
            },
            "spec": {
              "$ref": "#/$defs/chart"
            }
          },
          "required": [
            "type",
            "spec"
          ],
          "additionalProperties": false
        },
        {
          "type": "object",
          "properties": {
            "type": {
              "const": "embed"
            },
            "provider": {
              "const": "superchart"
            },
            "url": {
              "type": "string",
              "maxLength": 4096,
              "format": "uri"
            },
            "title": {
              "type": "string",
              "maxLength": 1000
            }
          },
          "required": [
            "type",
            "provider",
            "url",
            "title"
          ],
          "additionalProperties": false
        },
        {
          "type": "object",
          "properties": {
            "type": {
              "const": "timestamp"
            },
            "at": {
              "type": "string",
              "maxLength": 30,
              "format": "date-time",
              "pattern": "^\\d{4}-\\d{2}-\\d{2}T\\d{2}:\\d{2}:\\d{2}(?:\\.\\d{1,3})?Z$"
            },
            "label": {
              "type": "string",
              "maxLength": 1000
            }
          },
          "required": [
            "type",
            "at",
            "label"
          ],
          "additionalProperties": false
        }
      ]
    },
    "block": {
      "type": "object",
      "properties": {
        "id": {
          "type": "string",
          "minLength": 1,
          "maxLength": 128,
          "pattern": "^[A-Za-z0-9][A-Za-z0-9._:-]*$"
        },
        "parentId": {
          "anyOf": [
            {
              "type": "string",
              "minLength": 1,
              "maxLength": 128,
              "pattern": "^[A-Za-z0-9][A-Za-z0-9._:-]*$"
            },
            {
              "type": "null"
            }
          ]
        },
        "content": {
          "$ref": "#/$defs/content"
        },
        "citationIds": {
          "type": "array",
          "maxItems": 2000,
          "uniqueItems": true,
          "items": {
            "type": "string",
            "minLength": 1,
            "maxLength": 128,
            "pattern": "^[A-Za-z0-9][A-Za-z0-9._:-]*$"
          }
        }
      },
      "required": [
        "id",
        "parentId",
        "content",
        "citationIds"
      ],
      "additionalProperties": false
    },
    "chart": {
      "type": "object",
      "properties": {
        "kind": {
          "type": "string",
          "minLength": 1,
          "maxLength": 128,
          "pattern": "^[A-Za-z0-9][A-Za-z0-9._:-]*$"
        },
        "title": {
          "type": "string",
          "maxLength": 1000
        },
        "labels": {
          "type": "array",
          "minItems": 1,
          "maxItems": 20000,
          "items": {
            "type": "string",
            "maxLength": 1000
          }
        },
        "series": {
          "type": "array",
          "minItems": 1,
          "maxItems": 100,
          "items": {
            "type": "object",
            "properties": {
              "name": {
                "type": "string",
                "maxLength": 1000
              },
              "values": {
                "type": "array",
                "maxItems": 20000,
                "items": {
                  "type": "number",
                  "minimum": -1000000000000000,
                  "maximum": 1000000000000000
                }
              }
            },
            "required": [
              "name",
              "values"
            ],
            "additionalProperties": false
          }
        },
        "unit": {
          "type": "string",
          "maxLength": 100
        },
        "asOf": {
          "type": "string",
          "maxLength": 30,
          "format": "date-time",
          "pattern": "^\\d{4}-\\d{2}-\\d{2}T\\d{2}:\\d{2}:\\d{2}(?:\\.\\d{1,3})?Z$"
        }
      },
      "required": [
        "kind",
        "title",
        "labels",
        "series"
      ],
      "additionalProperties": false
    },
    "format": {
      "type": "object",
      "properties": {
        "page": {
          "enum": [
            "screen",
            "A4",
            "letter"
          ]
        },
        "font": {
          "enum": [
            "sans",
            "serif",
            "mono"
          ]
        },
        "fontSize": {
          "type": "number",
          "minimum": 8,
          "maximum": 72
        },
        "lineHeight": {
          "type": "number",
          "minimum": 1,
          "maximum": 3
        }
      },
      "required": [
        "page",
        "font",
        "fontSize",
        "lineHeight"
      ],
      "additionalProperties": false
    },
    "citation": {
      "type": "object",
      "properties": {
        "id": {
          "type": "string",
          "minLength": 1,
          "maxLength": 128,
          "pattern": "^[A-Za-z0-9][A-Za-z0-9._:-]*$"
        },
        "title": {
          "type": "string",
          "maxLength": 1000
        },
        "url": {
          "type": "string",
          "maxLength": 4096,
          "format": "uri"
        },
        "accessedAt": {
          "type": "string",
          "maxLength": 30,
          "format": "date-time",
          "pattern": "^\\d{4}-\\d{2}-\\d{2}T\\d{2}:\\d{2}:\\d{2}(?:\\.\\d{1,3})?Z$"
        },
        "publishedAt": {
          "type": "string",
          "maxLength": 30,
          "format": "date-time",
          "pattern": "^\\d{4}-\\d{2}-\\d{2}T\\d{2}:\\d{2}:\\d{2}(?:\\.\\d{1,3})?Z$"
        }
      },
      "required": [
        "id",
        "title",
        "url",
        "accessedAt"
      ],
      "additionalProperties": false
    },
    "persistedBlock": {
      "type": "object",
      "properties": {
        "id": {
          "type": "string",
          "minLength": 1,
          "maxLength": 128,
          "pattern": "^[A-Za-z0-9][A-Za-z0-9._:-]*$"
        },
        "parentId": {
          "anyOf": [
            {
              "type": "string",
              "minLength": 1,
              "maxLength": 128,
              "pattern": "^[A-Za-z0-9][A-Za-z0-9._:-]*$"
            },
            {
              "type": "null"
            }
          ]
        },
        "content": {
          "$ref": "#/$defs/content"
        },
        "citationIds": {
          "type": "array",
          "maxItems": 2000,
          "uniqueItems": true,
          "items": {
            "type": "string",
            "minLength": 1,
            "maxLength": 128,
            "pattern": "^[A-Za-z0-9][A-Za-z0-9._:-]*$"
          }
        },
        "version": {
          "type": "integer",
          "minimum": 1,
          "maximum": 9007199254740991
        },
        "createdAt": {
          "type": "string",
          "maxLength": 30,
          "format": "date-time",
          "pattern": "^\\d{4}-\\d{2}-\\d{2}T\\d{2}:\\d{2}:\\d{2}(?:\\.\\d{1,3})?Z$"
        },
        "updatedAt": {
          "type": "string",
          "maxLength": 30,
          "format": "date-time",
          "pattern": "^\\d{4}-\\d{2}-\\d{2}T\\d{2}:\\d{2}:\\d{2}(?:\\.\\d{1,3})?Z$"
        }
      },
      "required": [
        "id",
        "parentId",
        "content",
        "citationIds",
        "version",
        "createdAt",
        "updatedAt"
      ],
      "additionalProperties": false
    }
  }
}
